{
  "$schema": "https://json-schema.org/draft/2020-12/schema",
  "$id": "https://qor-logic.mythologiq/schemas/gates/plan.schema.json",
  "title": "Plan Gate Artifact",
  "type": "object",
  "additionalProperties": true,
  "not": {
    "required": ["terms_introduced"],
    "description": "GH #394: terms_introduced is a retired alias of the canonical `terms` field. additionalProperties: true would otherwise let it validate silently while every terms-reading check (doc_integrity.run_all_checks_from_plan) sees zero declared terms."
  },
  "required": [
    "phase",
    "ts",
    "session_id",
    "plan_path",
    "phases",
    "ci_commands"
  ],
  "properties": {
    "phase": {
      "const": "plan"
    },
    "ts": {
      "type": "string",
      "pattern": "^[0-9]{4}-[0-9]{2}-[0-9]{2}T[0-9]{2}:[0-9]{2}:[0-9]{2}Z$"
    },
    "session_id": {
      "type": "string",
      "minLength": 3
    },
    "plan_path": {
      "type": "string",
      "minLength": 1
    },
    "phases": {
      "type": "array",
      "items": {
        "type": "string"
      },
      "minItems": 1
    },
    "ci_commands": {
      "type": "array",
      "items": {
        "type": "string",
        "minLength": 1
      },
      "minItems": 1,
      "description": "Phase 38 B22: commands the operator runs locally to validate the plan before substantiate. Must match CI for deterministic parity. Required from Phase 38 forward; earlier plans grandfathered at test layer."
    },
    "open_questions": {
      "type": "array",
      "items": {
        "type": "string"
      }
    },
    "doc_tier": {
      "enum": [
        "minimal",
        "standard",
        "system",
        "legacy"
      ]
    },
    "doc_tier_rationale": {
      "type": "string",
      "minLength": 1
    },
    "terms": {
      "type": "array",
      "items": {
        "type": "object",
        "required": [
          "term",
          "home"
        ],
        "properties": {
          "term": {
            "type": "string",
            "minLength": 1
          },
          "home": {
            "type": "string",
            "minLength": 1
          }
        }
      }
    },
    "boundaries": {
      "type": "object",
      "properties": {
        "limitations": {
          "type": "array",
          "items": {
            "type": "string"
          }
        },
        "non_goals": {
          "type": "array",
          "items": {
            "type": "string"
          }
        },
        "exclusions": {
          "type": "array",
          "items": {
            "type": "string"
          }
        }
      }
    },
    "high_risk_target": {
      "type": "boolean",
      "description": "Phase 54: declare whether the downstream system being supported by this Qor-logic invocation is itself a high-risk AI system per EU AI Act Annex III. Default false; when true, impact_assessment is required."
    },
    "pr_target": {
      "type": "string",
      "minLength": 1,
      "description": "Phase 83 (GH #87): the branch this plan will be merged into, when it is not the default branch (e.g. a release branch 'RC1.4'). Optional; absent for plans targeting the default branch. Consumed by /qor-audit Step 0.6 delivery_branch_lint and the Phase 37 Delivery-Branch Currency sub-check."
    },
    "originating_remediation": {
      "type": [
        "string",
        "null"
      ],
      "description": "Phase 68 (GH #44): free-form reference to the issue, incident, or SG pattern this plan remediates (e.g., 'GH #44', 'SG-PlanTextDrift-A', 'the host project 3-VETO cycle 2026-05-08'). Read by /qor-audit Step 3.5 (Self-Application Sub-Pass): when set, the auditor manually performs the to-be-introduced discipline against the plan's own content. Optional; absence skips the sub-pass."
    },
    "impact_assessment": {
      "type": "object",
      "description": "Phase 54: optional NIST AI RMF MAP-3.1/MAP-5.1 + EU AI Act Art. 9 risk-register block. Required when high_risk_target is true.",
      "required": [
        "purpose",
        "affected_stakeholders",
        "identified_risks",
        "mitigations",
        "residual_risks"
      ],
      "properties": {
        "purpose": {
          "type": "string",
          "minLength": 1
        },
        "affected_stakeholders": {
          "type": "array",
          "items": {
            "type": "string"
          }
        },
        "identified_risks": {
          "type": "array",
          "items": {
            "type": "string"
          }
        },
        "mitigations": {
          "type": "array",
          "items": {
            "type": "string"
          }
        },
        "residual_risks": {
          "type": "array",
          "items": {
            "type": "string"
          }
        }
      }
    },
    "change_class": {
      "enum": [
        "hotfix",
        "feature",
        "breaking",
        "governance"
      ],
      "description": "Phase 168 (GH #248): the release class, previously carried only in plan prose (governance_helpers regex). Persisted here so the tier rules below are schema-enforceable. GH #282: 'governance' is the explicit non-release / version-not-applicable class for governance-only cycles where a version bump is inappropriate; version_applicability.validate treats it as version-not-applicable and the substantiate bump step skips."
    },
    "new_ceremony_artifacts": {
      "type": "array",
      "description": "Phase 169 (GH #251): net-new gate-artifact schemas this plan introduces, each with an L3-grade justification (>= 100 chars). gate_schema_freeze_lint flags unregistered schemas lacking this declaration -- ceremony artifacts accrete cost forever (research entry #378).",
      "items": {
        "type": "object",
        "required": [
          "name",
          "justification"
        ],
        "properties": {
          "name": {
            "type": "string",
            "pattern": "^[a-z0-9_]+(\\.schema\\.json)?$"
          },
          "justification": {
            "type": "string",
            "minLength": 100
          }
        }
      }
    },
    "required_gate_artifacts": {
      "type": "array",
      "items": {
        "enum": [
          "plan",
          "audit",
          "implement",
          "substantiate"
        ]
      },
      "minItems": 3,
      "uniqueItems": true,
      "description": "Phase 168 (GH #248, Shape 3 per research entry #394): the gate artifacts THIS phase must produce. Absent == the full chain (grandfathers all prior sessions). The short chain [plan, implement, substantiate] is permitted only for L1-risk hotfix changes (tier_guard verifies at implement time; completeness + provenance verify at seal/CI/merge); declaring it emits a severity-1 gate_override shadow event."
    },
    "ai_provenance": {
      "$ref": "_provenance.schema.json"
    },
    "spec_deltas": {
      "type": "array",
      "description": "Phase 192 (GH #277): behavioral spec deltas this plan authors. Each names the capability, the delta document (authored at plan time under qor/specs/<capability>/deltas/), the operations it carries, and optional grep-evidence for the changed surface. Linted at audit (specification-drift on failure); folded into the capability spec inside substantiate after PASS, then the delta file is deleted (git history is the archive).",
      "items": {
        "type": "object",
        "required": [
          "capability",
          "delta_path",
          "ops"
        ],
        "properties": {
          "capability": {
            "type": "string",
            "pattern": "^[a-z0-9][a-z0-9-]*$"
          },
          "delta_path": {
            "type": "string",
            "pattern": "^qor/specs/[a-z0-9][a-z0-9-]*/deltas/[^/]+\\.md$"
          },
          "ops": {
            "type": "array",
            "minItems": 1,
            "items": {
              "enum": [
                "ADDED",
                "MODIFIED",
                "REMOVED"
              ]
            }
          },
          "evidence": {
            "type": "string",
            "minLength": 1
          }
        }
      }
    },
    "feature_inventory_touches": {
      "type": "array",
      "description": "Phase 73 (GH #41): per-feature TDD declaration block. Each entry names a feature touched by this plan, the operation kind, and the test path + descriptor that proves the feature works. Required-when-touching-src/ enforcement is operator discipline in V1; mechanical lint deferred to V2. Empty array is acceptable for plans that touch only docs/governance.",
      "items": {
        "type": "object",
        "required": [
          "entry_id",
          "operation",
          "test_path",
          "test_descriptor"
        ],
        "properties": {
          "entry_id": {
            "type": "string",
            "minLength": 1
          },
          "operation": {
            "enum": [
              "NEW",
              "MODIFIED",
              "n/a-justified"
            ]
          },
          "test_path": {
            "type": "string",
            "minLength": 1
          },
          "test_descriptor": {
            "type": "string",
            "minLength": 1
          }
        }
      }
    },
    "execution_continuity": {
      "type": "object",
      "additionalProperties": false,
      "description": "Execution-continuity declaration (Phase 216; GH #285). References the upstream contract by version; carries only Qor-owned keys and only scalars.",
      "properties": {
        "contract_version": {
          "type": "string",
          "minLength": 1
        },
        "base_revision": {
          "type": "string",
          "minLength": 1
        },
        "target_revision": {
          "type": "string",
          "minLength": 1
        },
        "successor_actor_classes": {
          "type": "array",
          "items": {
            "type": "string"
          }
        },
        "checkpoint_points": {
          "type": "array",
          "items": {
            "type": "string"
          }
        },
        "receipt_required": {
          "type": "boolean"
        }
      },
      "required": [
        "contract_version"
      ]
    }
  },
  "allOf": [
    {
      "if": {
        "properties": {
          "doc_tier": {
            "const": "legacy"
          }
        },
        "required": [
          "doc_tier"
        ]
      },
      "then": {
        "required": [
          "doc_tier_rationale"
        ]
      }
    },
    {
      "if": {
        "properties": {
          "high_risk_target": {
            "const": true
          }
        },
        "required": [
          "high_risk_target"
        ]
      },
      "then": {
        "required": [
          "impact_assessment"
        ]
      }
    },
    {
      "if": {
        "required": [
          "required_gate_artifacts"
        ]
      },
      "then": {
        "properties": {
          "required_gate_artifacts": {
            "allOf": [
              {
                "contains": {
                  "const": "plan"
                }
              },
              {
                "contains": {
                  "const": "implement"
                }
              },
              {
                "contains": {
                  "const": "substantiate"
                }
              }
            ]
          }
        }
      }
    },
    {
      "if": {
        "properties": {
          "change_class": {
            "enum": [
              "feature",
              "breaking"
            ]
          }
        },
        "required": [
          "change_class",
          "required_gate_artifacts"
        ]
      },
      "then": {
        "properties": {
          "required_gate_artifacts": {
            "contains": {
              "const": "audit"
            }
          }
        }
      }
    }
  ]
}
