{
  "phase": "plan",
  "session_id": "2026-06-02T1249-0720c2",
  "ts": "2026-06-02T13:14:07Z",
  "plan_path": "docs/plan-qor-phase129-merge-throttle-enforcement.md",
  "phases": [
    "Phase 1: Merge-velocity enforcement (#153)",
    "Phase 2: Fragility contract + plan/implement wiring (#154)",
    "Phase 3: Doctrine"
  ],
  "ci_commands": [
    "python -m pytest tests/test_merge_throttle_enforcement.py tests/test_merge_velocity_check.py tests/test_workspace_fragility_check.py -q",
    "python -m pytest -q"
  ],
  "doc_tier": "standard",
  "originating_remediation": "GH #153 + #154 (SG-MergePaceThrottle-A)",
  "ai_provenance": {
    "system": "Qor-logic",
    "version": "0.95.0",
    "host": "unknown",
    "model_family": "unknown",
    "human_oversight": "absent",
    "ts": "2026-06-02T13:14:07Z"
  }
}