{
  "phase": "plan",
  "session_id": "2026-05-24T0600-phase103-p2",
  "ts": "2026-05-24T19:14:19Z",
  "plan_path": "docs/plan-qor-phase103-pypi-hardening-p2.md",
  "phases": [
    "Phase 1: pull-back verification + dependency-admission doctrine + tests"
  ],
  "ci_commands": [
    "python -m pytest tests/test_release_workflow_immutability.py -q",
    "python -m pytest tests/test_doctrine_dependency_admission.py -q",
    "python -m pytest tests/ -v",
    "python qor/scripts/check_variant_drift.py",
    "python qor/scripts/ledger_hash.py verify docs/META_LEDGER.md",
    "python -m pytest tests/test_packaging_install.py -v -m integration",
    "python -m qor.reliability.gate_chain_completeness --phase-min 52",
    "python qor/scripts/pr_citation_lint.py",
    "python -m qor.scripts.plan_text_consistency_lint --check docs/plan-qor-phase103-pypi-hardening-p2.md",
    "python -m qor.scripts.ci_coverage_lint --plan docs/plan-qor-phase103-pypi-hardening-p2.md --workflows-dir .github/workflows",
    "python -m qor.scripts.dod_check --plan docs/plan-qor-phase103-pypi-hardening-p2.md",
    "python -m qor.scripts.skill_size_budget_lint --skills-root qor/skills"
  ],
  "open_questions": [],
  "doc_tier": "standard",
  "doc_tier_rationale": "New doctrine + workflow step; tests verify properties; no system-tier doc rewrites.",
  "ai_provenance": {
    "system": "Qor-logic",
    "version": "0.70.0",
    "host": "unknown",
    "model_family": "unknown",
    "human_oversight": "absent",
    "ts": "2026-05-24T19:14:19Z"
  }
}