{
  "phase": "plan",
  "session_id": "2026-07-13T1819-b134f4",
  "ts": "2026-07-13T18:23:28Z",
  "plan_path": "docs/plan-qor-phase194-unify-governance-paths-ledger-dialect.md",
  "phases": [
    "Phase 1: shared canonical governance-path resolver",
    "Phase 2: topology + canary consume the resolver",
    "Phase 3: shared versioned ledger-dialect parser",
    "Phase 4: early version-applicability validation"
  ],
  "ci_commands": [
    "python -m pytest tests/test_governance_paths.py tests/test_ledger_dialect.py tests/test_version_applicability.py -q",
    "python -m pytest tests/test_doc_integrity.py tests/test_prompt_injection_canary.py tests/test_seal_entry_check.py tests/test_verify_ledger_cli.py tests/test_ledger_hash.py tests/test_ledger_hash_markup_cutoff.py tests/test_governance_health.py -q",
    "python -m qor.cli verify-ledger --ledger docs/META_LEDGER.md",
    "python -m pytest -q"
  ],
  "open_questions": [],
  "doc_tier": "minimal",
  "change_class": "feature",
  "originating_remediation": "GH #282",
  "feature_inventory_touches": [],
  "ai_provenance": {
    "system": "Qor-logic",
    "version": "0.132.0",
    "host": "claude-code",
    "model_family": "claude",
    "human_oversight": "absent",
    "ts": "2026-07-13T18:23:28Z"
  }
}