{
  "phase": "plan",
  "session_id": "2026-06-10T0000-hashcrlf157",
  "ts": "2026-06-10T06:34:38Z",
  "change_class": "hotfix",
  "doc_tier": "minimal",
  "plan_path": "docs/plan-qor-phase157-hash-guard-crlf-invariance.md",
  "phases": [
    "Phase 1: opt-in CRLF-invariant hashing in hash_file (qor/scripts/hash_guard.py)",
    "Phase 2: reference-doc guidance (qor/references/seal-gate-ladder.md)"
  ],
  "open_questions": [],
  "ci_commands": [
    "python -m pytest tests/test_hash_guard.py -q",
    "python -m qor.scripts.ledger_hash verify docs/META_LEDGER.md",
    "python -m qor.reliability.seal_entry_check --ledger docs/META_LEDGER.md --auto"
  ],
  "ai_provenance": {
    "system": "Qor-logic",
    "version": "0.109.4",
    "host": "unknown",
    "model_family": "unknown",
    "human_oversight": "absent",
    "ts": "2026-06-10T06:34:38Z"
  }
}