{
  "phase": "plan",
  "session_id": "2026-07-13T0837-ef73c7",
  "ts": "2026-07-13T08:39:20Z",
  "plan_path": "docs/plan-qor-phase183-intent-lock-verdict-forms.md",
  "phases": [
    "Phase 1: Widen + hint (TDD first)"
  ],
  "ci_commands": [
    "python -m pytest tests/test_intent_lock_anchored_pass_check.py tests/test_intent_lock.py -q",
    "python -m pytest -q",
    "python -m qor.scripts.ledger_hash verify docs/META_LEDGER.md"
  ],
  "open_questions": [],
  "doc_tier": "minimal",
  "change_class": "hotfix",
  "originating_remediation": "GH #263",
  "feature_inventory_touches": [],
  "ai_provenance": {
    "system": "Qor-logic",
    "version": "0.124.1",
    "host": "unknown",
    "model_family": "unknown",
    "human_oversight": "absent",
    "ts": "2026-07-13T08:39:20Z"
  }
}