{
  "phase": "plan",
  "session_id": "2026-10-05T1620-2b159a",
  "ts": "2026-10-05T16:39:22Z",
  "plan_path": "docs/plan-qor-phase303-boundary-lint-scope.md",
  "phases": [
    "Phase 1: Regression tests",
    "Phase 2: The lint ignores a terms-file BOM and can assert its scope",
    "Phase 3: CI states the boundary scope it intends",
    "Phase 4: The two shipped references invoke `qor-logic`",
    "Phase 5: Release-state continuity and CHANGELOG note"
  ],
  "ci_commands": [
    "python -m pytest tests/test_boundary_lint_expected_scope.py -q",
    "python -m pytest tests/test_publication_boundary_lint.py tests/test_boundary_scope_disclosure.py tests/test_boundary_untracked_coverage.py tests/test_github_surface_boundary.py tests/test_advisory_filing_control.py tests/test_substantiate_boundary_wiring.py tests/test_publication_boundary_policy.py tests/test_ci_coverage_lint.py tests/test_ci_workflow_gate_chain_completeness.py tests/test_ruff_adoption.py tests/test_skill_corpus_consolidation.py tests/test_qor_bootstrap_feature_index_template.py tests/test_layout_configurability.py tests/test_seal_ladder_tokens_survived.py tests/test_bootstrap_seed_correctness.py tests/test_compile.py tests/test_install_sync_with_source.py -q",
    "python qor/scripts/check_variant_drift.py",
    "python -m qor.scripts.publication_boundary_lint --repo-root . --expect-scope structural",
    "python -m pytest tests/test_release_state.py tests/test_changelog_tag_coverage.py -q",
    "python -m pytest tests/test_changelog_format.py -q",
    "python -c \"import subprocess; from pathlib import Path; from qor.scripts import release_state as rs; import tests.test_changelog_tag_coverage as t; remote = {l.rsplit('/', 1)[1] for l in subprocess.run(['git', 'ls-remote', '--tags', 'origin'], capture_output=True, text=True, check=True).stdout.split() if l.startswith('refs/tags/v') and not l.endswith('^{}')}; tags = {v for v in rs.merged_semver_tags(t.REPO) if 'v' + v in remote}; versions = t._changelog_versions() | {'0.175.7'}; ex = rs.load_release_state(t.RELEASE_STATE, versions); print(rs.coverage_violations(versions, tags, '0.175.7', ex).orphans, rs.coverage_violations(versions, tags, '0.175.7', {k: v for k, v in ex.items() if k != '0.175.6'}).orphans)\"",
    "(T=$(mktemp -d) && R=$(git ls-remote --tags origin | awk '{print $2}') && git clone -q --no-local . \"$T/c\" && git -C \"$T/c\" tag -l 'v*' | while read tg; do printf '%s' \"$R\" | grep -qx \"refs/tags/$tg\" || git -C \"$T/c\" tag -d \"$tg\" >/dev/null; done && cd \"$T/c\" && python -c \"import sys, tomllib; v = tomllib.load(open('pyproject.toml', 'rb'))['project']['version']; c = open('CHANGELOG.md', encoding='utf-8').read(); sys.exit(0 if v == '0.175.7' and '## [0.175.7] - ' in c else 'CI-view guard FAIL: clone is not a sealed 0.175.7 (project version ' + v + ')')\" && PYTHONPATH=. python -m pytest tests/test_changelog_tag_coverage.py -q -rs -p no:cacheprovider > \"$T/out\" 2>&1; rc=$?; cat \"$T/out\" 2>/dev/null; [ \"$rc\" -eq 0 ] && ! grep -q skipped \"$T/out\")",
    "python -m pytest tests/ -q",
    "python qor/scripts/ledger_hash.py verify docs/META_LEDGER.md",
    "python -m ruff check qor/ tests/"
  ],
  "open_questions": [],
  "doc_tier": "standard",
  "terms": [],
  "change_class": "hotfix",
  "originating_remediation": "GH #457",
  "feature_inventory_touches": [
    {
      "entry_id": "FX017",
      "operation": "n/a-justified",
      "test_path": "tests/test_boundary_lint_expected_scope.py",
      "test_descriptor": "publication_boundary_lint with --expect-scope exits 1 and prints the scope mismatch when the achieved scope differs from the expected one, in both directions, and exits 0 on a clean tree whose achieved scope matches"
    }
  ],
  "boundaries": {
    "limitations": [
      "CI still scans no identity terms, because no terms list is committed or provided to CI; --expect-scope structural makes that intent explicit and fail-closed, it does not add identity coverage (LD-8)",
      "only a byte-order mark at the very start of the terms file is removed (LD-4)",
      "the CLI-name fix covers exactly the two shipped skill reference lines named in GH #457 and their compiled variant copies, and other tracked files that still carry the same outside name are left as they are (LD-3)"
    ],
    "non_goals": [
      "a committed or CI-provided identity terms list",
      "rewriting sealed plans, gate artifacts, intent-lock records, the ledger or the shadow genome",
      "changing github_surface or advisory_filing_control",
      "changing the doctrine text",
      "release publication"
    ],
    "exclusions": [
      "identity terms in CI (left open by the owner, LD-8)",
      "the sealed-history occurrences of the outside name (left open by the owner, LD-3)"
    ]
  },
  "ai_provenance": {
    "system": "Qor-logic",
    "version": "0.175.6",
    "host": "claude-code",
    "model_family": "claude-opus",
    "human_oversight": "absent",
    "ts": "2026-10-05T16:39:22Z"
  }
}