{
  "phase": "plan",
  "session_id": "2026-09-02T1957-8d4f38",
  "ts": "2026-09-02T19:58:06Z",
  "plan_path": "docs/plan-qor-phase250-layout-configurability.md",
  "phases": [
    "resolve layout-bound paths through .qorlogic/config.json",
    "typed-skip contract with named layout keys"
  ],
  "ci_commands": [
    "python -m pytest -q",
    "python -m ruff check qor/ tests/",
    "python -m qor.scripts.check_variant_drift"
  ],
  "doc_tier": "standard",
  "terms": [],
  "change_class": "feature",
  "ai_provenance": {
    "system": "Qor-logic",
    "version": "0.163.3",
    "host": "claude-code",
    "model_family": "claude",
    "human_oversight": "absent",
    "ts": "2026-09-02T19:58:06Z"
  }
}