{
  "phase": "plan",
  "session_id": "2026-08-28T1956-6e0074",
  "ts": "2026-08-28T19:56:33Z",
  "plan_path": "docs/plan-qor-phase240-execution-context-governance.md",
  "phases": [
    "Phase 1 \u2014 Execution-context seam",
    "Phase 2 \u2014 Live skill migration",
    "Phase 3 \u2014 Wire real consumers",
    "Phase 4 \u2014 Compatibility and safety",
    "Phase 5 \u2014 Tests"
  ],
  "ci_commands": [
    "python -m pytest tests/test_execution_context.py tests/test_model_pinning_frontmatter.py tests/test_qor_audit_execution_context.py -q",
    "python -m pytest tests/ -q",
    "python qor/scripts/check_variant_drift.py",
    "python -m ruff check qor tests"
  ],
  "open_questions": [],
  "doc_tier": "system",
  "change_class": "governance",
  "originating_remediation": "GH #379",
  "feature_inventory_touches": [],
  "required_gate_artifacts": [
    "plan",
    "audit",
    "implement",
    "substantiate"
  ],
  "spec_deltas": [
    {
      "capability": "execution-context-governance",
      "delta_path": "qor/specs/execution-context-governance/deltas/2026-08-28T1956-6e0074.md",
      "ops": [
        "ADDED"
      ],
      "evidence": "qor/scripts/execution_context.py"
    }
  ],
  "ai_provenance": {
    "system": "Qor-logic",
    "version": "0.155.0",
    "host": "chatgpt",
    "model_family": "gpt-5.6-sol",
    "human_oversight": "absent",
    "ts": "2026-08-28T19:56:33Z"
  }
}